code,title,genre,summering,first_day,production_year,movie_director,star_actor,img,synopsis
20227338,티켓 투 파라다이스 (Ticket to Paradise),멜로/로맨스(1),"장편 | 일반영화 | 멜로/로맨스, 코미디 | 103분 51초 | 12세이상관람가 | 미국",2022-10-12,2022년,올 파커,줄리아 로버츠 | 조지 클루니 | 케이틀린 디버,https://www.kobis.or.kr/common/mast/movie/2022/09/thumb_x192/thn_d812bff0e98741faa4b47d2b4a1ae579.jpg,"사랑은 돌아오는 거야~
돌싱글즈에게 찾아온 U턴 로맨스

한때, 미치게 사랑했지만 지금은 인생의 원수가 되어버린
이혼한 부부 ‘조지아’(줄리아 로버츠)와 ‘데이빗’(조지 클루니).

대학을 졸업하고 변호사로 대형 로펌 입사를 앞둔 딸 ‘릴리’(케이틀린 디버)가
여행지 발리에서 만난 운명 같은 사랑과 결혼을 선포하자
딸이 자신들과 같은 실수를 반복하는 걸 볼 수 없는 그들은
어쩔 수 없이 동맹을 맺고 결혼을 막으려는 계획을 세우게 된다.

그러나 거듭되는 작전에도 불구하고 딸 ‘릴리’의 결혼식은 순조롭게만 진행되고
같은 목표를 향해 합심하는 이들도 서로에게 조금씩 감정의 변화가 생기게 되는데...
이혼 커플의 딸 결혼 반대 프로젝트는 성공할 수 있을까?"
20191145,티켓다방 2,멜로/로맨스,장편 | 일반영화 | 멜로/로맨스 | 76분 54초 | 청소년관람불가 | 한국,2019-12-26,2019년,최우성,,https://www.kobis.or.kr/kobis/web/comm/images/noimage289.jpg,"승태가 운영하고 있는 복싱 클럽으로 후배 재욱이 찾아온다.
재욱은 자기가 재미있는 곳을 안다며 승태를 티켓다방으로 데려간다.

재욱은 익숙하게 지수를 부르고 지수는 승태와도 인사를 한다.
지수는 다방이 처음인 순진한 승태에게 호감을 느낀다.

다음날 혼자 다방을 찾아간 승태는 지수를 복싱 클럽에 초대하고
운동을 가르쳐 주면서 점점 분위기가 무르익자 승태와 지수는 모텔로 향하는데..."
20191123,티켓다방 2 - 무삭제판,멜로/로맨스,장편 | 일반영화 | 멜로/로맨스 | 97분 58초 | 청소년관람불가 | 한국,2020-04-22,2019년,최우성,,https://www.kobis.or.kr/kobis/web/comm/images/noimage289.jpg,"승태가 운영하고 있는 복싱 클럽으로 후배 재욱이 찾아온다.
재욱은 자기가 재미있는 곳을 안다며 승태를 티켓다방으로 데려간다.

재욱은 익숙하게 지수를 부르고 지수는 승태와도 인사를 한다.
지수는 다방이 처음인 순진한 승태에게 호감을 느낀다.

다음날 혼자 다방을 찾아간 승태는 지수를 복싱 클럽에 초대하고
운동을 가르쳐 주면서 점점 분위기가 무르익자 승태와 지수는 모텔로 향하는데..."
20210972,티탄 (Titane),드라마(2),"장편 | 예술영화 | 드라마, SF, 스릴러 | 108분 12초 | 청소년관람불가 | 프랑스",2021-12-09,2021년,줄리아 듀코나우,뱅상 랭동,https://www.kobis.or.kr/common/mast/movie/2021/11/thumb_x192/thn_9ca2455718f44f14afc3f4be3ad2c754.jpg,"어린 시절, 교통사고로 뇌에 티타늄을 심고 살아가던 여성이
기이한 욕망에 사로잡혀 일련의 사건에 휘말리다
10년 전 실종된 아들을 찾던 슬픈 아버지와 조우하게 되며 벌어지는 이야기"
20191190,티토와 새 (Tito and the Birds),애니메이션,장편 | 일반영화 | 애니메이션 | 73분 0초 | 브라질,해당정보없음,2018년,,,https://www.kobis.or.kr/kobis/web/comm/images/noimage289.jpg,"티토는 어머니와 함께 사는 수줍은 10살 소년이다. 어느 날부턴가 갑작스럽게, 두려움을 느끼면 병에 걸리는 특이한 전염병이 번지기 시작한다. 티토는 실종된 아버지가 하던 새소리에 대한 연구가 이 병의 치료와 연관되어 있음을 곧 깨닫고 친구들과 함께 이 전염병으로부터 세계를 구하기 위한 여정에 오른다. 치료약을 찾으려는 티토의 여정은 티토 자신은 물론이거니와 그의 실종된 아버지의 정체성을 찾아가는 과정이 된다."
20239885,티티 지켜줄께,다큐멘터리,장편 | 일반영화 | 다큐멘터리 | 42분 19초 | 한국,해당정보없음,2022년,윤정은,,https://www.kobis.or.kr/kobis/web/comm/images/noimage289.jpg,"고양이의 고질적인 질병인 신장질환을 다룬 스토리입니다.
고양이에게 왜 신장염이 잘 걸리는지 전문가를 통해서 진단하고, 유사 질병에 걸린 고양이 인플루언서들을 만나서 그들의 얘기들을 들어보았습니다.
고양이 신장질환을 치료하기 위해 노력중인 한국 및 일본의 회사와 연구원들을 만나 치료약 현황을 상세하게 표현하고자 하였습니다.
희망을 갖는 것에서 그치지 않고 같은 고민을 하는 사람들을 찾아 방법을 찾아 실천 하게 되면, 고양이 신장 치료약도 더 나아가 사람의 신장 치료약도 좀 더 빨리 상용화 되기를 바래는 마음으로 작품을 기획하게 되었습니다."
20211313,"틱, 틱... 붐! (tick, tick... BOOM!)",드라마(1),"장편 | 일반영화 | 드라마, 뮤지컬 | 120분 2초 | 12세이상관람가 | 미국",2021-11-12,2021년,린-마누엘 미란다,앤드류 가필드 | 알렉산드라 쉽 | 로빈 데 헤수스 | 바네사 허진스 | 조슈아 헨리 | 브래들리 휘트포드 | 주디스 라이트,https://www.kobis.or.kr/common/mast/movie/2021/10/thumb_x192/thn_412a14b556294a498a5672319050e8da.jpg,"1990년 뉴욕, 식당에서 웨이터로 일하는 존(앤드루 가필드)은 뮤지컬의 전설로 남을 작품을 쓰겠다는 꿈을 이루기 위해 작곡에 매진한다. 그런데 인생의 중요한 기회가 될 수도 있는 공연을 며칠 앞두고 많은 일들이 갑작스레 몰려온다. 뉴욕이 아닌 곳에서 아티스트의 삶을 꿈꾸는 여자 친구 수전(알렉산드라 십), 꿈을 접고 경제적으로 안정된 삶을 선택한 친구 마이클(로빈 데 헤수스), 예술계를 뒤흔든 사회적 이슈 등이 그를 전방위로 압박한다. 서른 살 생일은 다가오고, 존은 예술가로서의 삶이 불안해지기 시작하는데..."
20011452,틱시 지구 (Tiexi District),다큐멘터리,장편 | 일반영화 | 다큐멘터리 | 300분 0초 | 중국,해당정보없음,2001년,왕빙,,https://www.kobis.or.kr/common/mast/movie/2014/03/thumb_x192/thn_701be594d7354859ab29ce5aa37dbd92.jpg,"일제 점령기에 생겨나 해방 후 바로 팽창하기 시작, 다시 1950년대 후반 소련의 투자로 더욱 성장한 선양의 중공업 도시, 틱시 지구는 단시일 내에 중국에서 가장 다양한 산업의 기지가 되었다. 그러나 1998년 공장들이 문을 닫기 시작한다. 1999년 겨울부터 2001년 연말까지 2년 동안 각기 다른 쇠락 단계의 세 공장을 담았다.

중국 셴양의 티엑시 공업지구. 이곳은 일제점령기에 생겨나 해방 후 빠른 속도로 성장하기 시작했으나 1990년대에 이르면서 하나 둘씩 문을 닫는다. 한때 100만 명이 넘는 노동자가 일하던 티엑시의 쇠퇴와 이 곳 주민들의 삶을 그린 이 작품은 중국 다큐멘터리 역사에 새로운 획을 그었다. 감독은 철거명령이 내려진 도시에 6밀리 카메라 하나만을 들고 2년여 동안 촬영하는 열정을 보였다. 러닝타임이 무려 9시간이 넘는 이 작품은 <녹>, <폐허>, <철로> 세 부분으로 나뉘어 있다."
20191403,틴 스피릿 (TEEN SPIRIT),드라마,장편 | 예술영화 | 드라마 | 93분 16초 | 12세이상관람가 | 미국,2019-09-04,2018년,맥스 밍겔라,엘르 패닝 | 즐라트코 버릭 | 밀리 브레디 | 레베카 홀,https://www.kobis.or.kr/common/mast/movie/2019/07/thumb_x192/thn_0eb183ca07ff4792876bd64f3f9c4179.jpg,"더 이상 망설일 수 없어
진짜 나를 보여줄게!

최고만이 설 수 있는 꿈의 무대,
춤, 노래, 그리고 열정 가득
세상을 빛낼 단 한 명의 스타탄생!"
20230608,틸 (Till),드라마,장편 | 일반영화 | 드라마 | 130분 54초 | 12세이상관람가 | 미국,2023-03-22,2022년,치노늬 추크우,다니엘 데드와일러(메이미) | 제일린 홀(에밋) | 헤일리 베넷(캐롤린) | 우피 골드버그(알마),https://www.kobis.or.kr/common/mast/movie/2023/02/thumb_x192/thn_034e7cb046db4c14b213dbd3feced5a2.jpg,"1955년 시카고.
엄마 메이미의 사랑을 듬뿍 받고 자란 14살 흑인 소년 에밋 틸은
미국 남부에 사촌을 만나러 갔다가 싸늘한 시신이 되어 돌아온다.

메이미는 에밋의 참혹한 모습을 세상에 공개해
억울한 죽음을 알리기로 결심하는데…

피부색으로 정의를 가리던 시대,
그녀의 용기 있는 외침이 시작된다."
20060351,팀 버튼의 크리스마스 악몽 (Tim Burton's The Nightmare Before Christmas),애니메이션(2),"장편 | 일반영화 | 애니메이션, 가족, 판타지 | 77분 0초 | 전체관람가 | 미국",1993년,개봉,헨리 셀릭,대니 엘프먼 | 크리스 서랜든 | 캐서린 오하라 | 윌리엄 히키,https://www.kobis.or.kr/upload/up_img/cleansing/51/thumb_x192/thn_mov_20060351_1.gif,"1년에 한 번 할로윈 축제를 위해서 사는 할로윈 마을. 할로윈 마을의 리더인 잭은 해골 귀신이다. 여느 때와 마찬가지로 할로윈을 준비해야하는 잭은 반복되는 일상에 염증을 느낀다. 그러던 어느날 잭은 우연히 할로윈 마을을 벗어나 크리스마스 마을에 도착한다.

할로윈 마을과는 판이하게 다른 크리스마스 마을을 보고 잭은 할로윈 마을에서 크리스마스 축제를 맡기로 한다. 잭과 그의 일당은 산타를 납치하고 산타 대신 해골이나 거미, 뱀 등을 크리스마스 선물로 준비해서 아이들에게 나누어주게 되고 크리스마스의 들뜬 기분은 사라지고 온통 소동만 일어난다. 이 모습을 본 잭은 자신이 무언가 잘못했음을 깨닫고 귀신들과 크리스마스 원래의 모습을 돌려주려 한다. 그러나 벌레 귀신이 산타를 잡아가 버린다. 그리하여 잭과 잭의 애인 헝겊 귀신 샐리는 산타를 구하기 위한 모험을 하게 되는데..."
20184530,팀장님의 아내,멜로/로맨스(1),"장편 | 일반영화 | 멜로/로맨스, 드라마 | 67분 26초 | 청소년관람불가 | 한국",2018-11-30,2018년,김영민,,https://www.kobis.or.kr/kobis/web/comm/images/noimage289.jpg,"병식은 회사 팀장인 석호의 신혼 집에 놀러 갔다가 석호의 아내, 애란을 보고 깜짝 놀란다.
그 이유는 애란은 한때 병식과 사귀던 대학교 시절 커플이었던 것.
과거 병식을 버리고 유학을 간다고 홀연히 사라졌던 병식의 첫사랑 애란.
그런 애란이 버젓이 병식의 직장 상사 석호와 결혼을 한 것에 병식은 말할 수 없는 배신감에 휩싸인다.

그러나 병식의 곁을 말없이 떠나야 했던 애란의 사연을 뒤 늦게 안 병식.
더욱이 애란이 남편 석호가 자신에게 퍼붓는 변태 같은 성 행위에 환멸을 느끼며
불행한 생활을 보내고 있으며 아직도 애란은 병식을 사랑하고 있음을 알고 두 사람은 괴로워한다.

석호는 오히려 회사 부하 직원인 내연녀 명선과 오랜 불륜을 저지르고 있음을 아는 병식은 급기야 애란을 찾아간다.
석호의 갑작스런 장기 출장 전날, 병식은 석호의 집으로 초대받게 되고 모두가 술에 취한 틈을 타 애란과 집에서 정사를 벌인다.

눈치를 챈 명선은 석호에게 폭로하겠다며 협박을 하는데, 병식은 어쩔 수 없이 명선과도 깊은 관계에 빠져 든다.
명선을 통해 첫사랑 애란은 병식을 한낱 성적 도구로밖에 생각하지 않음을 알게 된 병식은 괴로워하며 두 사람을 멀리하고자 하나 뜻대로 되질 않는데..."
20193175,팅커 그래디 (Tinker),드라마,장편 | 일반영화 | 드라마 | 97분 0초 | 미국,해당정보없음,2018년,소니 말러,클레인 크로포드(그래디 리 주니어) | 크리스찬 케인(부드로) | 윌머 칼데론(마나),https://www.kobis.or.kr/common/mast/movie/2019/12/thumb_x192/thn_fcc6d49d021f45d1b14c8ffd331f157a.jpg,"그래디는 우연히 생전에 아버지가 연구하셨던 '잭'이라는 전폭기계 도면을 발견하고 아버지의 연구를 이어간다. 여동생의 죽음으로 조카인 '카이'의 후견인이 되고, 단단하게 닫혀 있던 그래디의 마음도 조금씩 풀어진다.
어머니가 남겨 준 유품인 수정으로 카이도 그래디의 연구를 돕고, 그래디는 잭을 움직이는 동력원이 '조화'라는 것을 알게 되는데…"
20124134,"팅커 테일러 솔저 스파이 (Tinker, Tailor, Soldier, Spy)",스릴러,"장편 | 일반영화 | 스릴러 | 127분 0초 | 15세이상관람가 | 영국, 프랑스, 독일",2011년,개봉,토마스 알프레드슨,게리 올드만 | 콜린 퍼스 | 베네딕트 컴버배치 | 톰 하디 | 마크 스트롱 | 스티븐 그레이엄,https://www.kobis.or.kr/common/mast/movie/2023/03/thumb_x192/thn_2562a23d35cf45f98c1c8d920088a89b.jpg,"영국의 비밀정보부 요원 ‘조지 스마일리’(게리 올드만)는
러시아 스파이의 색출 작전에 실패한 후 은퇴하지만,
본부로부터 다시 한번 비밀 작전을 맡게 된다.

한편, 러시아 고위급 장교를 감시 중이던 현장요원 ‘리키 타르’(톰 하디)는
서커스라 불리는 MI6의 최고위급 간부 4명,
정보부장을 포함한 고위 관료 중 한 명이 스파이임을 알게 된다.

이제, ‘조지 스마일리’는 어제까지의 동료였던 정보부 모든 이들을 상대로
자신의 임무를 들키지 않고 스파이를 가려내야만 하는데...

코드네임 팅커, 테일러, 솔저, 스파이,
조직 내부에 숨어있는 스파이를 찾아라!"
