code,title,genre,summering,first_day,production_year,movie_director,star_actor,img,synopsis
20172986,리베라시옹 데이 (Liberation Day),다큐멘터리,"장편 | 일반영화 | 다큐멘터리 | 100분 0초 | 노르웨이, 기타",해당정보없음,2016년,,,https://www.kobis.or.kr/kobis/web/comm/images/noimage289.jpg,"유고슬라비아 출신 슬로베니아 밴드 라히바흐는 정치, 사회, 문화적으로 마치 요새처럼 고립된 북한에서 공연한 최초의 락앤롤 밴드이다. 이들은 엄격한 사회주의 국가에서 락앤롤 음악을 전혀 경험한 적 없는 관중들을 비롯한 많은 문화적 차이들에 부딪히게 된다. 이 밴드가 검열의 작은 틈 사이에서 노래하기 위해 고군분투하는 한편, 남한과 북한 사이 국경에 선전용 스피커가 설치되고 두 나라 사이에는 긴장감이 흐르며 전쟁 카운트다운이 발표된다."
20194723,런던 필드 (London Fields),범죄(2),"장편 | 일반영화 | 범죄, 미스터리, 스릴러 | 107분 38초 | 영국",해당정보없음,2018년,,,https://www.kobis.or.kr/kobis/web/comm/images/noimage289.jpg,"“모두 니컬라 식스를 원한다”

어느 날, 런던의 한 펍에서 글의 소재를 찾기 위해 영국으로 온 작가 ‘샘슨 영(빌리 밥 손튼)’과
사기꾼이자 다트 선수인 ‘키스 탤런트(짐 스터게스)’, 상류층 은행가 ‘가이 클린치(테오 제임스)’,
그리고 미스터리하면서도 매혹적인 여인 ‘니컬라 식스(앰버 허드)’가 조우한다.

그 중 ‘니컬라 식스’는 미래를 볼 줄 아는 여인으로
언젠가 자신이 살해당할 것이라는 예감을 가진 채 살아왔으며,
그날 펍에서 만난 세 남자 중 자신을 살해할 남자가 있다는 사실을 안다.

그리고 그런 ‘니컬라 식스’에게 강한 매력을 느낀 세 남자는 그녀에게 속절없이 빠져드는데…

과연 그녀는 누구의 손에 살해당할 것인가?"
20190002,롱 샷 (LONG SHOT),코미디,장편 | 일반영화 | 코미디 | 124분 46초 | 15세이상관람가 | 미국,2019-07-24,2019년,조나단 레빈,샤를리즈 테론 | 세스 로건,https://www.kobis.or.kr/common/mast/movie/2019/07/thumb_x192/thn_09b64de2f764421682701928e9dd9fb9.jpg,"어리다고 놀리지 말아요! 첫사랑 베이비시터 누나 ♥

전직 기자 지금은 백수인 ‘프레드 플라스키’(세스 로건)는
20년 만에 첫사랑 베이비시터 ‘샬롯 필드’(샤를리즈 테론)와 재회한다.

그런데 그녀가!?
미 최연소 국무 장관이자 세계에서 가장 영향력 있는 여성 중 한 명인 ‘샬롯’이
바로 베이비시터 그녀라는 것은 믿기지 않지만 실화이다.

인생에 공통점이라고는 1도 없는 두 사람.
대선 후보로 출마를 준비 중인 ‘샬롯’은 모두의 예상을 깨고
자신의 선거 캠페인 연설문 작가로 ‘프레드’를 고용한다.
어디로 튈지 모르는 ‘프레드’ 때문에 선거 캠페인은 연일 비상인 가운데,
뜻밖에 그의 스파크는 ‘샬롯’과의 로맨스로 튀어 버리는데...

사고 치는데 천부적인 재능이 있는 남자,
머리부터 발끝까지 완벽한 여자

이 조합 실화?"
20194305,라나와 보낸 여름 (Zomer Zonder Mama),드라마,장편 | 일반영화 | 드라마 | 68분 0초 | 네덜란드,해당정보없음,2019년,,,https://www.kobis.or.kr/kobis/web/comm/images/noimage289.jpg,"수잔은 엄마가 시리아에서 전쟁 특파원이기 때문에 할머니와 여름을 함께 보낸다. 그녀는 할머니 집 근처에 최근에 지어진 피난민 캠프를 방문하고 밝은 색의 옷을 입은 매혹적인 소녀 라나와 친구가 된다. 그들은 많은 공통점을 가지고 있으며, 그들은 '엄마 없는 여름'에 서로를 돕는다."
20175771,라이온 킹 (The Lion King),어드벤처(2),"장편 | 일반영화 | 어드벤처, 드라마, 가족 | 118분 7초 | 전체관람가 | 미국",2019-07-17,2018년,존 파브로,도날드 글로버 | 비욘세 놀즈 | 제임스 얼 존스 | 치웨텔 에지오포 | 세스 로건,https://www.kobis.or.kr/common/mast/movie/2019/06/thumb_x192/thn_58d1d60084b649b7928cd6072c5c07de.jpg,"새로운 세상, 너의 시대가 올 것이다!
어린 사자 ‘심바’는 프라이드 랜드의 왕인 아버지 ‘무파사’를
야심과 욕망이 가득한 삼촌 ‘스카’의 음모로 잃고 왕국에서도 쫓겨난다.

기억해라! 네가 누군지.

아버지의 죽음에 대한 죄책감에 시달리던 ‘심바’는
의욕 충만한 친구들 ‘품바’와 ‘티몬’의 도움으로 희망을 되찾는다.
어느 날 우연히 옛 친구 ‘날라’를 만난 ‘심바’는 과거를 마주할 용기를 얻고,
진정한 자신의 모습을 찾아 위대하고도 험난한 도전을 떠나게 되는데…"
20192661,리벤지: 엄마의 분노 (Atone),액션,장편 | 일반영화 | 액션 | 89분 51초 | 청소년관람불가 | 미국,2019-07-10,2017년,웨스 밀러,재클린 플레밍 | 로버트 러슬러,https://www.kobis.or.kr/common/mast/movie/2019/06/thumb_x192/thn_9ad0f284f12a42c2959dfa9795a54ace.jpg,"1년전 남편을 잃어 어두운 나날을 보내는 한 여자 하지만 딸에게만은 따뜻하고 밝은 모습을 보여주려고 노력하는 여자가 있다. 그녀는 그녀의 아버지의 추천을 통해 남편과 그녀가 다니던 교회에 취직하게 되고 새로 지어진 웅장한 교회로 향하게 된다. 그녀의 첫 출근과 함께 벌어지는 무장 강도들의 침입! 이제 교회 안에는 그녀와 딸 그리고 교회 사람들이 인질로 잡히게 된다.
그녀는 딸을 지키기 위해 위험을 해쳐 나가게 되고 교회의 숨겨져 왔던 비밀들도 알게 된다.
무장 강도들은 왜 교회로 왔으며 교회에 어떤 비밀이 숨겨져 있는가!
그녀의 딸을 지키기 위해 벌어지는 끊임없는 액션! 그녀는 과연 딸을 지킬 수 있을 것인가!"
20050167,"링2(1999년, 일본판)",공포(호러),장편 | 일반영화 | 공포(호러) | 95분 0초 | 15세관람가 | 일본,2000-07-29,1999년,나카타 히데오,사토 히토미(쿠라하시 마사미) | 나카타니 미키(타카노 마이),https://www.kobis.or.kr/common/mast/movie/2011/12/thumb_x192/thn_9fcb9dc7a56942b6b4303332478961f8.jpg,"류지와 레이코는 우물 속에서 30년전에 죽은 사다코의 시체를 발견하지만, 부검 결과 시체는 죽은지 몇년 되지 않았다는 사실이 드러난다. 류지 교수의 조교였던 마이는 류지가 죽은 이유를 알아내기 위해 전부인인 레이코가 일하던 곳으로 가고, 그녀가 저주받은 비디오에 대한 취재를 하고 있었다는 것을 알게 된다. 그러나 레이코와 그녀의 아들은 이미 사라졌고, 불에 탄 흔적이 남아있는 비디오만 발견된다. 그러는 가운데에서도 저주의 비디오는 계속하여 사람들에게 퍼져나가는데..."
20193858,릴리안 (Lillian),드라마,장편 | 일반영화 | 드라마 | 128분 0초 | 오스트리아,해당정보없음,2019년,,,https://www.kobis.or.kr/kobis/web/comm/images/noimage289.jpg,뉴욕에서 발이 묶인 이민자인 릴리안은 그녀의 고향인 러시아로 돌아가기로 결심한다. 그녀는 긴 여정에서 결연히 출발한다. 미국을 가로질러 알래스카의 추운 온도로 곧장 가는 도로 영화. 서서히 사라지는 시간의 연대기.
20193667,로스트 인 베를린 (Lost in Klessin),전쟁(2),"장편 | 일반영화 | 전쟁, 액션, 드라마 | 88분 43초 | 12세이상관람가 | 독일",2019-07-09,2018년,하인트제이 피터,,https://www.kobis.or.kr/common/mast/movie/2019/07/thumb_x192/thn_935d865a29484917a4855d3be419bf6b.jpg,"기사철십자훈장을 받은 독일 최고의 군인 스톡 대위는
베를린을 침략하려는 러시아군에 맞서
최전방을 지키며 클레신을 수호하라는 명을 받는다.
젊은 시절부터 함께했던 전우이자 친구인 로버트와 오토와 함께
전장을 누비며 승리를 거두던 그이지만
점차 포위망을 좁혀오는 러시아군과 부족한 보급품 및 인력으로
힘들게 싸움을 이어가고, 정부에선 그 어떤 지원도 나오지 않는 상황.
스톡 대위는 조국을 지키겠다는 사명으로
클레신을 수호하기 위해 단 250명의 병력과 함께
러시아군과의 전투에 사활을 건 싸움을 시작한다."
20192906,라이딩 업힐 (Riding Uphill),드라마,장편 | 예술영화 | 드라마 | 105분 33초 | 12세이상관람가 | 일본,해당정보없음,2018년,에구치 칸,,https://www.kobis.or.kr/common/mast/movie/2019/06/thumb_x192/thn_17f3476b5bf442dc998c5a9385ebeebf.jpg,"8년 전까지만 해도 리그 위에 당당히 섰던 프로 야구 선수 ‘하마지마’
하지만 현실은 술과 도박에 빠져 가족들에게 버림받은 처량한 신세이다.

하나 뿐인 아들에게 떳떳한 아빠가 되고 싶은 그는
어느날 우연히 나이 제한 없다는 경륜 학교의 정보를 듣고
마지막 기회라 여기고 도전하게 된다.

하지만 한참 어린 동기생 사이에서 역부족인 데 이어,
사생활 문란, 최고령 등의 이유로 무시 받기 일쑤인데…

과연, 그는 냉정한 스포츠 세계에서 다시 한번 일어설 수 있을까?"
20192960,레이드배커스 (LAIDBACKERS),애니메이션(1),"장편 | 일반영화 | 애니메이션, 액션 | 58분 40초 | 12세이상관람가 | 일본",해당정보없음,2019년,하시모토 히로유키,하나모리 유미리,https://www.kobis.or.kr/common/mast/movie/2019/06/thumb_x192/thn_94fc7fef10bc45ae888a04b58903cef0.jpg,"할머니의 막과자가게를 이어 받기 위해 교토로 이사한 미대생 ‘쿠미’.
아무도 없어야 할 가게에는 ‘하라미’, ‘K’, ‘마이’ 그리고 강아지 한 마리가 살고 있다(?!)

‘하라미’ 일행의 정체는 마왕을 쫓아 검과 마법의 세계에서 온 용사들!
그러나 다른 세계로 온 탓에 힘을 잃고, 리더인 공주기사 ‘아넬리아’마저
하필이면 강아지의 모습으로 바뀌어 버려 무일푼 백수가 되고 만 것이다.

머물 곳도 없고, 상식과도 거리가 먼 그녀들을 내치지 못한 ‘쿠미’는
수상한 용사들과 이상한 동거를 하게 된다.

그러던 어느 날, 힘을 잃고 평범한 초등학생이 된 마왕 ‘란’이
평화롭고 한가로운 나날을 보내고 있던 그들 앞에 모습을 드러내는데!"
20192348,로보독 (Robo-Dog),가족(1),"장편 | 일반영화 | 가족, SF | 87분 0초 | 미국",해당정보없음,2015년,제이슨 머피,마이클 캠피온 | 패트릭 멀둔 | 올리비아 다보,https://www.kobis.or.kr/common/mast/movie/2019/06/thumb_x192/thn_4e70a0a2dc704ca7910ca13f6aca9fc7.jpg,"만능 로봇 강아지!
울트라 초특급 슈퍼 댕댕이 탄생!

반려견 강아지가 갑작스러운 사고로 세상을 떠나버리자 슬픔에 빠진 아들 타일러를 위해 발명가인 톰은 강아지와 100% 싱크로율의 슈퍼 배터리를 장착한 ‘로보-독’을 만들어준다. 말하기는 물론 놀랍도록 빠른 스피드와 파워, 진공청소기 기능까지 탑재한 상상을 초월한 능력을 갖춘 슈퍼 ‘로보-독’이지만 로봇 강아지에게 타일러의 마음은 쉽게 열리지 않는다. 한편, 톰이 다니던 회사의 사장 윌리스는 슈퍼 배터리의 위력을 감지하고 ‘로보-독’을 손에 넣기 위해 위험천만한 방법을 동원하기 시작하는데……"
20192545,래빗 (Rabbit),스릴러(1),"장편 | 일반영화 | 스릴러, 미스터리 | 100분 2초 | 15세이상관람가 | 호주",해당정보없음,2017년,루크 샤나한,,https://www.kobis.or.kr/kobis/web/comm/images/noimage289.jpg,"의대생 모드는 쌍둥이 언니가 납치된 꿈을 꾼다. 그리고 그 꿈은 너무 생생하다.사실 언니는 몇 년 전 사라져 생사를 알 수 없는 상태다. 언니가 살아있을 거라는 확신을 하고 언니의 약혼자 그리고 경찰인 친구와 함께 언니를 찾아 나선다. 그곳에선 쌍둥이에 관한 연구가 비밀리에 진행되고 있었고, 결국 3명 모두 잡히고 마는데…"
20198453,롱 리브 더 킹: 목포 영웅 (Long Live the King),액션(1),"장편 | 일반영화 | 액션, 드라마 | 117분 37초 | 15세이상관람가 | 한국",2019-06-19,2019년,강윤성,김래원(장세출) | 원진아(강소현) | 진선규(조광춘) | 최귀화(최만수) | 주진모(소팔) | 진선규(조광춘) | 황정인(최만수 수행비서),https://www.kobis.or.kr/common/mast/movie/2019/06/thumb_x192/thn_02734968436a44ad93c3f1e742e6e3d3.jpg,"거대 조직의 보스로 거침 없이 살고 있는 ‘장세출’은
철거 용역으로 나간 재건설 반대 시위 현장에서 만난 강단 있는 변호사 ‘강소현’의 일침으로
그녀가 원하는 ‘좋은 사람’이 되기로 마음 먹는다.

좋은 세상이 뭣이요?
나 장세출, 한 번 맘 먹으면 지구 끝까지 가는 그런 인간이요

모든 것을 내려놓고 새사람이 되기 위해 노력하던 ‘장세출’은 우연히 버스추락 사고에서 온 몸으로 시민을 구하며
일약 목포 영웅으로 떠오르게 되고, 예기치 못한 사건으로 국회의원에 출마하게 된다.

발로 뛰며 점점 시민의 마음을 움직인 ‘장세출’의 입지가 높아지자,
목포에서 3선을 노리던 반대파 후보 ‘최만수’는 ‘장세출’을 눈엣가시로 여기고
그를 저지하기 위해 ‘장세출’의 라이벌 조직 보스 ‘조광춘’과 손을 잡고 음모를 계획하는데….

장세출, 주먹판보다 더한 선거판에 뛰어들다!
세상을 바꾸기 위한 물러 설 수 없는 통쾌한 역전극이 펼쳐진다!"
19998810,로제타 (Rosetta),드라마,"장편 | 예술영화 | 드라마 | 93분 50초 | 15세이상관람가 | 프랑스, 벨기에",2019-05-23,1999년,장 피에르 다르덴 |뤽 다르덴,에밀리 드켄 | 파브리지오 롱기온 | 앤 에르노스,https://www.kobis.or.kr/common/mast/movie/2019/04/thumb_x192/thn_31cccc432fc047b98cf970820ab03f2e.jpg,"“내 이름은 로제타
내일 할 일 하나, 평범한 삶을 살기”

일자리 구하기, 친구 만들기, 엄마와 행복하기
누군가에게 가장 평범한 일상조차 로제타에겐 쉽게 허락되지 않는다.
어제보다 나은 오늘을 꿈꾸던 로제타에게 어느 날, 작은 희망이 보이기 시작하는데…"
20199743,러시안 브라이드 (The Russian Bride),액션(1),"장편 | 일반영화 | 액션, 스릴러 | 101분 22초 | 청소년관람불가 | 미국",해당정보없음,2018년,마이클 S. 오헤이다,코빈 번슨,https://www.kobis.or.kr/common/mast/movie/2019/04/thumb_x192/thn_585e0ecdbdd144a3984f209afec21186.jpg,가정폭력을 일삼는 남편을 피해 미국으로 오려는 러시아 여성 니나는 오랜 노력끝에 인터넷매칭 사이트에서 나이든 은둔의 억만장자의 초대를 받아 딸 다샤와 함께 결혼을 조건으로 미국으로 오게 된다. 딸의 새로운 삶을 위해 모든 걸 희생하려는 니나는 결혼의 목적이 다샤의 목숨을 노리는 무서운 음모임을 알게 된다. 니나는 딸을 구하기 위해 자신의 모든 걸 건 무자비한 싸움을 벌이게 된다.
20196944,러브라이브! 선샤인!! 더 스쿨 아이돌 무비 오버 더 레인보우 (Love Live! Sunshine!! The School Idol Movie: Over the Rainbow),애니메이션,장편 | 일반영화 | 애니메이션 | 100분 22초 | 전체관람가 | 일본,2019-02-14,2019년,사카이 카즈오,이나미 안쥬(타카미 치카 목소리) | 아이다 리카코(사쿠라우치 리코 목소리) | 스와 나나카(마츠우라 카난 목소리) | 코미야 아리사(쿠로사와 다이아 목소리) | 사이토 슈카(와타나베 요우 목소리) | 코바야시 아이카(츠시마 요시코 목소리) | 타카츠키 카나코(쿠니키다 하나마루 목소리) | 스즈키 아이나(오하라 마리 목소리) | 후리하타 아이(쿠로사와 루비 목소리),https://www.kobis.or.kr/common/mast/movie/2019/01/thumb_x192/thn_cde429ce79f1432796c8853a695d9ab7.png,"우라노호시 여고의 스쿨 아이돌로서 참가하는 마지막 '러브라이브!'에서 멋지게 우승을 따낸 Aqours.
새로운 학교로 편입할 준비를 하던 1, 2학년들에게 예상 밖의 트러블이 연발한다?
게다가 졸업여행을 떠난 3학년들이 행방불명?!
멀리 떨어진 후에야 처음으로 깨달은 서로의 빈 자리.
새로운 한 걸음을 내딛기 위해, Aqours가 도달한 결론은 무엇일까?
함께 달려온 빛나는 오늘을 넘어서
미래로 날아가려는 모든 사람들에게 바치는, 최고의 라이브 엔터테인먼트 무비!"
20198291,로켓맨 (Rocketman),드라마(1),"장편 | 일반영화 | 드라마, 판타지 | 121분 7초 | 15세이상관람가 | 영국, 미국",2019-06-05,2019년,덱스터 플레처,태런 에저튼 | 리처드 매든 | 브라이스 달라스 하워드 | 제이미 벨,https://www.kobis.or.kr/common/mast/movie/2019/05/thumb_x192/thn_66c0aa97d0504f23ae39aa9438e45de6.jpg,"천재적인 음악성과 독보적인 노래로 세상을 뒤흔들며 대중을 사로잡은 ‘엘튼 존’(태런 에저튼).
연이은 히트곡 발매와 환상적인 무대 퍼포먼스, 화려한 패션으로 가장 빛나는 시대의 아이콘으로 자리잡는다.
그러나 인생 최고의 순간, 어린 시절부터 자신의 진가를 알아봐주지 못한 부모에 대한 상처와 사랑했던 친구의 배신에 무대 뒤에 숨겨진 또 다른 자신과 마주하게 되는데…"
20192342,레이크 (Renegades),액션(1),"장편 | 일반영화 | 액션, 스릴러 | 105분 0초 | 프랑스, 독일",해당정보없음,2017년,스티븐 쿼일,J.K. 시몬스 | 설리반 스탭플턴 | 실비아 획스 | 이완 브렘너,https://www.kobis.or.kr/kobis/web/comm/images/noimage289.jpg,"나치가 숨겨놓은 금괴를 찾아라!

기자로 위장한 미 해군 특수부대 네이비 씰 5명은 세르비아-보스니아 분쟁지역에서 군사작전을 벌이던 중 팀원 '스탠턴'의 여자친구 '라라'로부터 수몰된 마을 호수에 2차 세계 대전 당시 나치가 숨겨놓은 3억 달러의 금괴를 찾아 50:50으로 나누자는 엄청난 제안을 받게 되는데…"
20182981,리벤져 (Revenger),액션,장편 | 일반영화 | 액션 | 101분 29초 | 15세이상관람가 | 한국,2018-12-06,2018년,이승원,브루스 칸(김율) | 박희순 | 윤진서 | 김인권,https://www.kobis.or.kr/common/mast/movie/2018/11/thumb_x192/thn_b368f2fc23a44767acc21e12677371a1.jpg,"악마를 잡기 위해 악마가 되다!

극악무도한 사형수들을 격리시켜 놓은,
어떠한 법도 상식도 통하지 않는 죽음의 섬 ‘수라도’
이곳을 지배하는 절대악 ‘쿤’(박희순)을 잡기 위해
스스로 악마가 되는 길을 택해 사형수가 되어 ‘수라도’에 들어온
전직 특수경찰 ‘율’(브루스 칸)

‘율’은 ‘쿤’의 아지트를 찾던 중
우연히 마주친 ‘말리’(윤진서)와 ‘바우’(김인권)로 인해 과거의 신분이 들통나게 되고
모두가 죽이고 싶어하는 살해 대상으로 지목된다.
더 이상 물러날 곳이 없는 ‘율’은 복수를 위해 목숨을 건 반격을 시작하는데…

죽기 싫으면 죽여야 하는 섬 ‘수라도’
이곳에서 사생결단 서바이벌 액션이 시작된다!"
20190245,로지 (Rosie),드라마,장편 | 예술영화 | 드라마 | 86분 0초 | 12세이상관람가 | 아일랜드,2019-05-16,2018년,패디 브레스내치,사라 그린 | 모 던포드,https://www.kobis.or.kr/common/mast/movie/2019/04/thumb_x192/thn_88a01b1ff2d9442ea40f46287c26820d.jpg,"집을 잃은 후 잘 곳도, 머물 곳도 사라진 가족.
로지와 남편 폴, 그리고 어린 네 아이들은
작은 자동차에 의지해 새로운 보금자리를 찾아 나선다.

오늘만 견디면 될 거라고 생각했던 내일이 반복되면서,
당장 밤을 함께 보낼 방 한 칸 조차 구하지 못하는
극한의 상황까지 도달한 가족.

설상가상 이웃들까지 로지의 이러한 상황을 눈치채고 마는데…
로지는 세상의 냉혹함과 마주한 현실 속에서
사랑하는 가족을 지켜내려 발버둥치기 시작한다."
20191723,로데오 카우보이 (The Rider),드라마,장편 | 일반영화 | 드라마 | 104분 0초 | 미국,해당정보없음,2017년,,,https://www.kobis.or.kr/kobis/web/comm/images/noimage289.jpg,젊은 카우보이 브래디는 낙마 사고를 겪은 뒤 트라우마에 시달린다. 인생에 목적을 제공해주던 ´승마와 경쟁´을 더 이상 할 수 없게 된 것을 깨달은 카우보이가 이제 무엇을 위해 살아야 하는가를 찾게 되는 성장드라마.
20190267,리틀 포니 프린세스 (Pony with a Broken Wing),판타지(1),"장편 | 일반영화 | 판타지, 드라마 | 86분 37초 | 전체관람가 | 미국",2019-04-30,2019년,지오지오 세라피니,조나단 실버맨 | 카리스마 카펜터,https://www.kobis.or.kr/common/mast/movie/2019/04/thumb_x192/thn_a1818c87f44d48c6be0c0564a8d48d59.jpg,"가족과 함께 목장을 운영하는 ‘시드니’.
시드니는 어려워진 가정 형편으로 인해 목장을 팔고 이사를 하게 될까 불안하다.
그러던 어느 날, 산책하던 시드니는 날개가 부러진 조랑말 ‘하모니’를 발견하게 되고,
어른들에게 이 사실을 숨긴 채 조랑말을 보살피게 되는데.."
20199923,라플라스의 마녀 (Laplace's Witch),미스터리(1),"장편 | 일반영화 | 미스터리, 스릴러 | 115분 8초 | 12세이상관람가 | 일본",2019-05-09,2018년,미이케 다카시,사쿠라이 쇼 | 히로세 스즈 | 후쿠시 소타 | 타마키 히로시 | 릴리 프랭키,https://www.kobis.or.kr/common/mast/movie/2019/04/thumb_x192/thn_80107c4e8cb948e28f144a064203be4f.jpg,"유명 온천 휴양지, 영화 제작자의 시신이 발견된다.
사인은 황화수소 중독.
사망 사건이 발생한 지형적 특성상, 단순 사고를 확신하는 ‘아오에(사쿠라이 쇼)’ 교수 앞에
보험금을 노린 살인 사건으로 의심하는 ‘나카오카(타마키 히로시)’ 형사,
연쇄 살인의 가능성을 예고하는 미스터리한 소녀 ‘우하라 마도카(히로세 스즈)’가 나타난다.

그리고 얼마 뒤, 또 다른 온천 휴양지에서 무명 영화배우가 황화수소 중독으로 사망하는 사건이 발생한다.
‘아오에’ 교수는, ‘나카오카 ‘형사의 가설하에 0.001%의 살인 가능성을 파헤치게 되는데…

인간의 한계를 넘어선 불가사의한 사망 사건 발생!
우연한 사고인가, 연쇄 살인 사건인가! 살인을 증명하라!"
20191465,라 푼타 (La Punta),다큐멘터리,장편 | 일반영화 | 다큐멘터리 | 2분 0초 | 이탈리아,해당정보없음,2013년,아핏차퐁 위라세타쿤,,https://www.kobis.or.kr/kobis/web/comm/images/noimage289.jpg,베니스 영화제 70주년을 맞아 세계 각국의 감독들이 만든 2분 내외의 짧은 옴니버스 영화다.
20183814,레티나 (Retina),스릴러,장편 | 일반영화 | 스릴러 | 87분 33초 | 15세이상관람가 | 미국,2019-04-24,2017년,카를로스 페레르,,https://www.kobis.or.kr/common/mast/movie/2018/11/thumb_x192/thn_8800e192c46f4a9fb19990cc2cb7d993.jpg,"남편의 외도를 목격하고 집을 나와 혼자 살던 에이프릴은
불안 치료제 개발에 관련된 의료 연구에 참여하면 사례비를 준다는 전화를 받고 실험에 참여하기로 한다.
병원에서 준 약을 먹은 후, 에이프릴은 끊임없이 악몽에 시달리고 꿈과 현실 사이의 경계가 흐려지는 부작용에 시달린다.
그러던 중 누군가 자신을 죽이려 한다는 사실을 깨닫고 필사적으로 도망치는데…"
20191118,릴리와 동물 친구들 (Little Miss Dolittle),드라마,장편 | 일반영화 | 드라마 | 100분 0초 | 독일,해당정보없음,2018년,,,https://www.kobis.or.kr/kobis/web/comm/images/noimage289.jpg,"11살 릴리는 동물과 이야기를 할 수 있어요! 사실 이건 릴리의 부모님을 제외하고는 아무도 모르는 비밀이랍니다. 그 특별한 능력이 과거에 이런저런 문제를 일으켜 가족이 이사를 다녀야 했기 때문이죠. 새 집에 도착하면서 자기 자신에게 이 비밀을 꼭 지키기로 다짐하던 찰나, 못된 동물 도둑이 아기 코끼리 로니를 지역 동물원에서 납치했다는 것을 알게 된 릴리는 새 친구인 제스와 함께 로니와 다른 동물들을 구하기 위한 모험길에 오르는데…"
20190266,레전더리: 툼 오브 더 드래곤 (Legendary: Tomb of the Dragon),액션(1),"장편 | 일반영화 | 액션, 어드벤처 | 92분 29초 | 15세이상관람가 | 영국",2019-04-23,2013년,에릭 스타일스,스콧 앳킨스 | 돌프 룬드그렌 | 황혁 | 제임스 랜스,https://www.kobis.or.kr/common/mast/movie/2019/04/thumb_x192/thn_f16aa6d96da64c769ff26fd0976e535d.jpg,"지상 최대의 괴생명체가 나타났다!
인간들의 반격이 시작된다!
생포할 것인가? 사살할 것인가?

갑자기 나타난 거대 괴생명체를 잡기 위해
각 분야의 전문가들이 모여들기 시작한다.

그 안에서 생포하려는 자들과
사살하려는 자들의 엇갈린 의견으로
상황은 점점 극으로 치닫게 된다.

괴생명체의 위협이 더욱 거세지는 가운데,
과연 인간들의 반격은 성공할 것인가?"
