code,title,genre,summering,first_day,production_year,movie_director,star_actor,img,synopsis
20208155,레프 야신 (Lev Yashin),드라마,장편 | 일반영화 | 드라마 | 111분 17초 | 러시아,해당정보없음,2019년,,율리야 클리니나 | 알렉세이 구스코프,https://www.kobis.or.kr/common/mast/movie/2020/09/thumb_x192/thn_81c0f09dd1734f178bd0dc35ee8d8e33.jpg,"축구 역사상 최고의 골키퍼 ‘레프 야신’
오직 그만이 막을 수 있다!
그라운드를 승리로 이끈 영웅의 성공 신화가 펼쳐진다!

러시아의 소련 시기에 평범한 노동자 계급이었던 소년 시절을 보낸 레프 야신은 어릴 적부터 밤낮으로 축구를 해왔고 그라운드의 최전방 수비수인 골키퍼가 되는 것이 그의 유일한 꿈이었다. 야신의 천부적 재능은 유소년시절부터 뛰게 된 축구 경기 에서도 단연 돋보였고 ‘거미손’라는 별칭이 생길 만큼 골을 막아 승률을 높이는 데 큰 역할을 해내며 구단주들의 눈에 띄어 축구계의 유망주로 입지를 굳혀간다. 선수로 활약하며 주요 축구 대회에서 수상을 하는 데 큰 공을 세우기도 하고 디나모 대표팀과의 첫 경기에서 어이없이 내어준 골로 인해 2년 동안 벤치 생활을 하는 등 굴곡진 선수 시절을 보낸다. 하지만 야신은 포기하지 않고 주전으로 돌아가기 위해 혹독한 훈련을 받은 뒤 1960년 유러피안 컵 소련 국가대표로 선발된다. 이후 1962년 칠레 월드컵에서 칠레에 패해 8강에서 탈락한 뒤 선수 경력이 끝날 위기에 처하지만 1963년 런던에서 열린 세계 올스타 팀 경기에서 활약하여 야신의 위상은 다시 높아지기 시작하는데…"
20208889,로켓 파이어 (Rocket Hunter),액션(2),"장편 | 일반영화 | 액션, 드라마, 전쟁 | 80분 14초 | 미국",해당정보없음,2020년,크리스토퍼 포브스,,https://www.kobis.or.kr/common/mast/movie/2020/09/thumb_x192/thn_2637faecbebc484cb4ae65a9091803c7.jpg,"2차 세계대전 중 폭격기 B-17 조종사인 미국인 콜은 중대하고 위험한 임무를 맡는다. 독일 전투기 ME-109에 올라 미사일 제조 시설이 있는 콘슈타인으로 가서 V-2 미사일 발사를 막는 것과 동시에 런던 시민들을 보호하는 것이다. ‘로켓 헌터’는 전쟁의 그늘로 드리워진 암흑기 1945년 1월, 하늘에서 활약한 뛰어난 조종사 형(콜)과 포격수 동생(조)의 이야기를 중심으로 2차 세계대전 독일과 맞선 영국군과 미국군의 합동 작전의 일면을 다룬 작품이다."
20207346,리부트 (K.O.),스릴러,장편 | 일반영화 | 스릴러 | 113분 2초 | 프랑스,해당정보없음,2017년,,로랑 라피트 | 피오 마르마이,https://www.kobis.or.kr/kobis/web/comm/images/noimage289.jpg,"방송국의 거만한 CEO 앙투안은 평소 주변 사람들을 우습게 알며, 독단적인 성격으로 일을 처리한다. 사생활 역시 복잡해서 주변 사람들에게 쉽게 상처를 입힌다.
그러던 어느 날, 앙투안은 주변의 앙심을 품은 인물에 의해 총을 맞아 혼수 상태에 빠지게 되고 깨어난 뒤에 세상이 갑자기 180도 달라져 있는 것을 알게 된다.
자신이 방송국에서 일하는 것은 그대로이지만 기상 캐스터가 되어 있었고 주변 사람들 역시 조금씩 달라져 있었다.
앙투안은 이 모든 게 자신의 환각인지, 아니면 누군가의 고약한 복수인지 혼란스러워 하는데..."
20208480,루시아 (A Winter to Remember),멜로/로맨스(1),"장편 | 일반영화 | 멜로/로맨스, 드라마 | 63분 34초 | 아르헨티나",해당정보없음,2016년,,,https://www.kobis.or.kr/common/mast/movie/2020/09/thumb_x192/thn_fbc5f6aae3794219bbf5349ff1e9f287.jpg,루시아는 친구들과 놀러간 클럽에서 만난 올리에게 첫눈에 빠져든다. 급격하게 가까워지는 두 사람. 심지어 올리가 이미 남자친구가 있다는 이야기를 들었는데도 루시아의 마음은 식을 줄을 모른다. 벗어날 수 없는 유혹의 시작.
20208176,리틀 킹덤 (Little Kingdom),드라마,장편 | 일반영화 | 드라마 | 105분 0초 | 슬로바키아,해당정보없음,2019년,,브라이언 카스피,https://www.kobis.or.kr/common/mast/movie/2020/09/thumb_x192/thn_54cba1063ac74fc4a24ba02ef05da6d1.jpg,"2차 대전, 독일의 괴리정권인 슬라바키아 공화국 소속 군인이던 잭은 탈영해서 아내가 있는 마을로 간다.
잭이 탈영한 직후, 나치 세력에 반대하던 반란군이 잭의 부대원들을 전부 몰살시킨다.
잭은 탈영병임을 숨기고 아내 에바와 새출발을 꿈꾸며 살아간다. 하지만 잭이 일하는 공장 사장 '바'가 어느 날 자신과 결혼한 신부라며 소개한 캣이라는 여인을 보고 잭은 깜짝 놀라는데...

잭이 탈영하던 날 밤, 주점에 있던 여인이 캣이었다. 분명히 부대원들이 몰살당했는데 캣만 살아남은 것을 보고 잭은 캣을 의심한다. 캣 역시 잭이 탈영했다는 비밀을 알고 있다.
한편, 독일군이 점점 수세에 몰리면서 독일 편에 섰던 공장 사장 '바'의 입지 역시 흔들리기 시작한다. 때마침 비밀 경찰까지 마을에 들이닥치면서 평화롭던 시골 마을에 전쟁의 피바람이 분다."
20206066,루브르박물관 기획특별전 (A NIGHT AT THE LOUVRE : LEONARDO DA VINCI),다큐멘터리,장편 | 일반영화 | 다큐멘터리 | 95분 27초 | 전체관람가 | 프랑스,2020-09-16,2020년,,,https://www.kobis.or.kr/kobis/web/comm/images/noimage289.jpg,루브르 박물관에 전시된 레오나르도 다빈치의 여러 작품들에 대해 설명하며 그의 삶과 작품세계를 탐색하는 내용의 다큐멘터리
20203344,라스트 솔져스 (Thirst),전쟁(2),"장편 | 일반영화 | 전쟁, 스릴러, 액션 | 92분 30초 | 기타",해당정보없음,2018년,,,https://www.kobis.or.kr/common/mast/movie/2020/09/thumb_x192/thn_99e68c4ea1f048138c65dc79c0bcd9d0.jpg,"이라크 군의 포로가 되어 사막에 파묻혀 있다가
극적으로 탈출한 미군 부대 일원들은
사막의 열기와 타는 듯한 갈증 속에서
살아남기 위해 고군분투한다.
한 사람씩 죽어나가는 극한의 상황 속에서
애써 잊고 있던 과거의 갈등이 올라오는데…!

사막 한 가운데 고립된 군인들!
극한의 상황 속에서 끝까지 살아남아라!"
20201386,로그 워페어 3 데스 오브 네이션 (Rogue Warfare 3: Death of a Nation),전쟁(1),"장편 | 일반영화 | 전쟁, 액션 | 93분 0초 | 15세이상관람가 | 미국",2020-08-26,2020년,마이크 건서,윌 윤 리,https://www.kobis.or.kr/common/mast/movie/2020/07/thumb_x192/thn_7a67fad3fd6b4a02950851925ac15388.jpg,"전쟁 액션 3부작의 최종장
마침내 최후의 전면전이 시작된다!

포로로 잡힌 핵심 대원을 구출한 로그 팀.
정밀 탐색으로 드디어 블랙 마스크의 은거지를 찾아낸다.
블랙 마스크는 방사능 폭탄으로 세계에 선전포고를 준비한다.
일급비밀 출동명령이 떨어지고 은거지에 침투한
로그 팀과 블랙 마스크의 전면전이 시작되는데…

드디어 마지막 전투를 만난다!"
20203581,라스트 보이 (The Last Boy),SF(1),"장편 | 일반영화 | SF, 드라마 | 87분 0초 | 영국",해당정보없음,2019년,페리 반달,루크 고스 | 피터 귀네스,https://www.kobis.or.kr/common/mast/movie/2020/07/thumb_x192/thn_b6b59d8d8b624c5c896338be11139d3f.jpg,"갑작스럽게 찾아온 돌풍으로 인류는 멸망의 기로에 서고,
엄마는 죽기 직전 아들 시라에게 소원을 이루어 주는 장소를 표시한 지도를 준다.
지도와 스캐너를 챙겨 먼 길을 떠난 시라는 우연히 한 사제와 그를 따르는 여인 무리를 만난다.
정체를 알 수 없는 사제는 시라가 숨기고 있는 놀라운 비밀을 알아내기 위해 조금씩 위협을 가하는데..."
20205384,리얼파이터 (Real Fighter),액션,장편 | 일반영화 | 액션 | 92분 37초 | 15세이상관람가 | 한국,해당정보없음,2019년,김춘식|김경택,황동희 | 권해성,https://www.kobis.or.kr/common/mast/movie/2020/08/thumb_x192/thn_a0024307ae344ed6b95046e7544222be.jpg,"뛰어난 실력의 종합격투기 프로선수 태성은 UFC 데뷔전을 앞두고 친구 병진 가게의 싸움에 휘말리며 부상을 입고 선수 자격도 잃게 된다. 병진의 여동생이자 종합격투기 전문 BJ인 혜나는 태성에게 재기를 권하지만 실의에 빠진 태성은 거절한다.
혜나는 태성을 부상 입힌 남자가 실제 길거리 싸움을 매칭한 후 배팅을 할 수 있는 불법 도박 게임사이트 '블러드 스트리트'의 최강 챔피언 양호열임을 알게 되고 태성에게 알린다. 태성은 오직 복수를 위해 '블러드 스트리트' 싸움판에 복면을 한 채 뛰어든다. 블러드 스트리트 유저들은 복면한 태성을 '리얼 파이터'라고 부르며 열광한다.
하지만 게임사는 게임 운영 전체를 방해하는 태성을 처리하기 위해 함정을 만들고 태성은 위기에 처한다. 위기의 순간 태성을 구한 것은 챔피언 양호열. 진정한 상대를 원했던 호열은 태성에게 모든 진실을 알려 준다.
게임사가 처음부터 태성을 '블러드 스트리트'로 끌어들이기 위해 음모를 꾸몄던 것.
태성과 호열은 블러드 스트리트의 음모를 부수고, 진짜 챔피언이 되기 위한 싸움을 시작한다!"
20206248,로드 투 카불 (Road to Kabul),액션,장편 | 일반영화 | 액션 | 112분 0초 | 모로코,해당정보없음,2012년,,,https://www.kobis.or.kr/kobis/web/comm/images/noimage289.jpg,"카사블랑카(Casa Blanca)에 사는 4명의 무직 청년들 알리(Ali), 흐미다(Hmida), 음바렉(Mbarek), 메소우드(Messoud)는 더 나은 삶을 위해 네덜란드로 떠날 꿈을 꾼다. 어느 날 브로커를 알게 된 친구들은 모두의 돈을 모아 선발대로 흐미다를 먼저 네덜란드로 보낸다. 하지만 곧 흐미다가 네덜란드가 아닌 아프가니스탄 카불(Kabul)에 도착한 것을 알게 되고 나머지 3명의 친구는 흐미다를 찾아 카불로 향한다."
20203861,레브 (REV),액션(1),"장편 | 일반영화 | 액션, 드라마 | 92분 28초 | 15세이상관람가 | 캐나다",2020-08-20,2020년,,비비카 A. 폭스,https://www.kobis.or.kr/common/mast/movie/2020/07/thumb_x192/thn_5701b21dfac74bd594f2c774f9438947.jpg,경찰차 절도 범죄 경력이 있는 마이키가 경찰의 정보원이 되어 차량 절도 범죄 조직에 들어간다. 수백만 달러어치의 차를 훔쳐 국외로 밀반출하는 이 국제적인 범죄 조직에서 마이키는 살아남을 수 있을까?
20204688,래퍼 등에 소리꾼 (RAPSORI),다큐멘터리,장편 | 일반영화 | 다큐멘터리 | 68분 0초 | 한국,해당정보없음,2019년,김병일,,https://www.kobis.or.kr/kobis/web/comm/images/noimage289.jpg,"<래퍼 등에 소리꾼>은 극영화의 형식을 빌려 서천의 판소리 역사에 자부심을 갖는 창극 단원들과 마을 사람들뿐만 아니라, 명창이 되기 위해 단련하는 십 대 소리꾼의 모습을 담는다. 그 중심에는 전직 래퍼이자 현재는 사진을 찍고 소리를 기록하는 한 남자가 있는데, 그는 서천에서 우연히 십 대 소리꾼을 만나 판소리 기행을 하게 된다. 판소리에 대한 관심으로 시작된 영화는 제목에서도 드러나듯, 랩과 판소리가 대화를 하듯 어우러지며 과거와 현재, 동양과 서양의 경계가 흐려지는 흥취의 순간에 도달한다."
20202614,래미와 친구들: 푸른푸른 초원의 위기 (The Mythical Ark : Adventures in Love & Happiness),애니메이션,장편 | 일반영화 | 애니메이션 | 82분 9초 | 전체관람가 | 중국,2020-07-30,2013년,웨이밍 황,김경희(래미) | 황창영(울피),https://www.kobis.or.kr/common/mast/movie/2020/07/thumb_x192/thn_5007f0d60661478c8086ff56a639ebf1.jpg,"귀염뽀짝 히어로들의 좌충우돌 세계 구하기!

울피는 양 부족을 잡아먹으려고 날씨 조절 장치란 새로운 무기를 발명한다. 이 장치를 쓰면 원하는 대로 자연재해를 불러일으킬 수 있지만 래미 일행과 맞붙은 울피는 역시나 계획이 어긋나며 목적을 달성하지 못한다. 결국 자신의 무기를 더욱 새롭게 업그레이드시키려던 울피는 그만 실수로 장치가 고장 나면서 날씨 괴물이 탄생하자 푸른푸른 초원에는 온갖 자연재해가 발생한다. 결국 촌장은 과거 조상들이 만든 방주에 올라 푸른푸른 초원에서 탈출하려고 하지만 방주는 모든 종류의 동물이 다 탑승하였을 때만 출발할 수 있다. 결국 래미와 친구들은 마지막 남은 동물을 찾아 나서는데..."
19928737,록 허드슨의 홈 무비 (Rock Hudson’s Home Movies),기타,장편 | 일반영화 | 기타 | 63분 0초 | 미국,해당정보없음,1992년,마크 레포트,,https://www.kobis.or.kr/kobis/web/comm/images/noimage289.jpg,"이 영화는 콜라주 영화로, 파운드 푸티지가 주인공이다. 이 작품은 우리 모두가 다 알고 있는 사실(그가 동성애자였고 에이즈로 죽었다는)에 비추어 허드슨이 출연한 영화를 재검토해 기존의 영화사를 수정한다."
20060284,라디오 스타 (Radio Star),드라마,장편 | 일반영화 | 드라마 | 115분 0초 | 12세관람가 | 한국,2006-09-28,2006년,이준익,박중훈 | 안성기 | 신정근(미사리 남 사장),https://www.kobis.or.kr/upload/up_img/cleansing/x00/03/12/thumb_x192/thn_mov_20060284_42750.jpg,"잠잠했던 88년도 가수왕 최곤. 매니저 속도 모르고 또 사고 치다. 명곡 '비와 당신'으로 88년 가수 왕을 차지했던 최곤은 그 후 대마초 사건, 폭행사건 등에 연루돼 이제는 불륜커플을 상대로 미사리 까페촌에서 기타를 튕기고 있는 신세지만, 아직도 자신이 스타라고 굳게 믿고 있다. 조용하나 싶더니 까페 손님과 시비가 붙은 최곤은 급기야 유치장 신세까지 지게 되는데…일편단심 매니저 박민수는 합의금을 찾아 다니던 중 지인인 방송국 국장을 만나고, 최곤이 영월에서 DJ를 하면 합의금을 내준다는 약속을 받아낸다. 라디오 DJ로 컴백한 철없는 락스타의 겁없는 방송이 시작된다. 프로그램 명 '최곤의 오후의 희망곡' 하지만 DJ자리를 우습게 여기는 최곤은 선곡 무시는 기본, 막무가내 방송도 모자라 부스 안으로 커피까지 배달시킨다. 피디와 지국장마저 두 손 두발 다 들게 만드는 방송이 계속되던 어느 날, 최곤은 커피 배달 온 청록 다방 김양을 즉석 게스트로 등장시키고 그녀의 사연이 많은 이들의 심금을 울리며 방송은 점차 주민들의 호응을 얻는다. 그러나 성공에는 또 다른 대가가 있는 법… 서로 눈빛만 보아도 알 것 같은 두 남자 때문에, 오늘 전국이 울고 웃는다."
20202361,러브 인 히말라야 (Kedarnath),드라마,장편 | 일반영화 | 드라마 | 113분 15초 | 기타,해당정보없음,2018년,아비쉑 카푸르,수샨트 싱 라즈풋,https://www.kobis.or.kr/common/mast/movie/2020/07/thumb_x192/thn_e7aa28133bdb4181b116d54fea43fc5e.jpg,"“당신이 어디에 있든 내가 데리러 갈 테니까”

길 잃은 신들의 쉼터이자 순례자들의 천국이라 불리는 곳, 케다르나스.
그곳에서 짐꾼으로 일하는 무슬림 청년 ‘만수르’(서샨트 싱 라즈풋)는
힌두교의 가장 높은 계급에 속하는 브라만 자제 ‘무쿠’(사라 알리 칸)와 우연히 마주친다.

티격태격했던 첫 만남 이후, 서로의 꾸밈없는 모습에 이끌린 두 사람은
종교와 신분의 차이를 뛰어넘어 운명적 사랑에 빠지게 된다.
하지만 ‘무쿠’는 이 사실을 알게 된 아버지로 인해 다른 사람과 정략결혼을 하게 되고,
‘만수르’ 역시 다시 돌아오겠다는 약속만을 남긴 채 마을에서 쫓겨난다.
그리고 ‘만수르’가 마을을 벗어나는 순간,
전대미문의 대홍수가 케다르나스를 집어삼키고
‘만수르’는 ‘무쿠’와의 약속을 지키기 위해 위험에 빠진 마을로 발길을 돌리는데.."
20201962,래미의 드래곤월드 구출작전 (Adventures on the Dragon's Trail),애니메이션,장편 | 일반영화 | 애니메이션 | 79분 5초 | 전체관람가 | 중국,2020-07-16,2012년,웨이밍 황,김경희(래미) | 이소은(메이) | 황창영(울피) | 이슬(식탐),https://www.kobis.or.kr/common/mast/movie/2020/07/thumb_x192/thn_cfa3b3109e38424488f77900ca8ca4f4.jpg,"양떼 친구들의 단 하나뿐인 귀염뽀짝 히어로 래미,
드래곤월드에 갇힌 부모님을 구해라!

전설로만 존재하는 줄 알았던 용이 마을에 하나둘씩 나타난다.
꼬마 용 카멜레온은 래미와 친구들에게 용이 사는 세상인 드래곤 월드에 문제가 생겨서 양 떼 마을에 더 많은 용이 나타나고 있다고 말한다.
한편 시간 및 공간 이동 장치로 여행 중이던 래미의 부모님은 래미와 연락을 하던 중 그만 기계가 고장 나며 다른 차원의 세계로 들어간다.
래미의 부모님이 드래곤월드에 계시다는 것을 알게 된 래미와 친구들은 래미의 부모님을 구출하기로 하는데…."
20202543,링고의 귀환 (The Return of Ringo),기타,"장편 | 일반영화 | 기타 | 95분 0초 | 이탈리아, 스페인",해당정보없음,1966년,두치오 테사리,줄리아노 젬마 | 페르난도 산초,https://www.kobis.or.kr/common/mast/movie/2020/07/thumb_x192/thn_091d927c74af4ad1bd46eaf1030140ac.jpg,"전작 <총잡이 링고>는 기록적인 성공을 거두었고, 두치오 테사리는 곧바로 ‘정식 후속편’을 만들었다. 고향으로 돌아온 링고는 멕시코의 갱들로부터 자신의 가족과 약혼자를 지키기 위한 싸움을 시작한다. 그리고 이를 위해 정체를 숨기고 갱단에 잠입을 시도한다."
20207895,로그 워페어 2 더 헌트 (ROGUE WARFARE 2 THE HUNT),전쟁(1),"장편 | 일반영화 | 전쟁, 액션 | 103분 18초 | 15세이상관람가 | 미국",2020-06-03,2019년,마이크 건서,윌 윤 리,https://www.kobis.or.kr/common/mast/movie/2020/05/thumb_x192/thn_8dfec339050c465db6cc75c8dde14b86.jpg,"다국적 특수부대의
일급비밀 구출작전이 시작된다!

극단적 테러단 블랙마스크와 각국에서 선발된
다국적 특수부대 로그 팀의 정면대결이 시작된다.
팀원을 구하려던 최정예 대원이 포로로 잡히고
백악관은 일급비밀 구출작전 명령을 발령한다.
로그 팀은 테러단의 은폐된 거점을 찾아 출동하고
마침내, 비밀침투 구출작전이 시작되는데…

극강의 전투를 경험한다!!"
20200582,리벤지 라이드 (Revenge Ride),범죄(2),"장편 | 일반영화 | 범죄, 액션, 스릴러 | 74분 0초 | 미국",해당정보없음,2020년,,,https://www.kobis.or.kr/common/mast/movie/2020/06/thumb_x192/thn_9f174397583e488f97236d0262d4eac1.jpg,"남자들에게 깊은 증오심을 가진 여자들의 갱단 ‘다크문’.
리더 ‘트리가’와 함께 다크문을 이끌던 ‘매기’는
사촌 ‘매리’가 성범죄를 당했다는 사실을 알게 된 이후
다크문 멤버들과 함께 가해자들에게 확실한 복수를 실행한다.
하지만 멈추지 않는 트리가는 도우려던 ‘브라이언’조차 해를 입히려 하고
그로 인해 결국 매기는 트리가와 대립하게 되는데...!"
20134603,로마 위드 러브 (To Rome with Love),코미디,"장편 | 예술영화 | 코미디 | 111분 0초 | 청소년관람불가 | 미국, 이탈리아, 스페인",2012년,개봉,우디 알렌,제시 아이젠버그(잭) | 엘렌 페이지(모니카 ) | 알렉 볼드윈(존) | 페넬로페 크루즈(애나) | 로베르토 베니니(레오폴도) | 그레타 거윅(샐리) | 우디 알렌(제리 ),https://www.kobis.or.kr/common/mast/movie/2020/06/thumb_x192/thn_b56870ee054549c3bf83e319780079bc.jpg,"상상 속 짜릿한 일탈이 모두 이루어지는 유쾌한 로마 여행이 시작된다!

첫 번째 일탈, 로마를 사랑하는 건축학도 ‘잭’
여자친구의 친구 ‘모니카’와 아찔한 사랑에 빠지다!

두 번째 일탈, 평범한 아버지이자 남편, 그리고 로마 시민 ‘레오폴도’
하루아침에 초대형 스타가 되다!

세 번째 일탈, 새로운 삶을 위해 로마로 떠나온 남편 ‘안토니오’
아내 ‘밀리’가 잠시 자리를 비운 사이 갑자기 나타난 콜걸 ‘안나’를 만나 본능에 눈뜨다!

네 번째 일탈, 은퇴한 오페라 감독 ‘제리’
예비 사돈이자 장의사인 ‘미켈란젤로’에게서 엄청난 재능을 발견하다!"
20208741,루키스 (The Rookies),액션,장편 | 일반영화 | 액션 | 112분 54초 | 15세이상관람가 | 중국,2020-05-20,2019년,원금린,밀라 요보비치 | 왕대륙 | 상드린 피나 | 데이비드 맥기니스,https://www.kobis.or.kr/common/mast/movie/2020/05/thumb_x192/thn_21f593e118614b24af33176cf2283b8a.jpg,"“발을 들여놓으면 빠져나갈 수 없어”

위험천만 익스트림 스포츠를 즐기는 관종 ‘펑’(왕대륙)은
마천루의 꼭대기를 점령하기 위한 사투를 벌이다가
우연한 기회(?)로 전 세계를 장악하려는 국제범죄조직들의
비밀 거래 현장에 착륙하게 되고
그들을 쫓던 국제첩보조직 ‘팬텀’의 보스 ‘브루스’(밀라 요보비치)에 의해
세계 테러를 막을 비밀 스파이로 스카우트되는데…

대책 없는 무근본 스파이들의
기상천외한 첩보 작전이 시작된다!"
20185383,"레미: 집 없는 아이 (Remi, Nobody's Boy)",가족(2),"장편 | 예술영화 | 가족, 어드벤처, 드라마 | 108분 31초 | 전체관람가 | 프랑스",2020-05-28,2018년,앙트완 블로시에르,다니엘 오떼유(비탈리스) | 루디빈 사니에(발브렝 부인),https://www.kobis.or.kr/common/mast/movie/2020/05/thumb_x192/thn_6bc5ce7cff69415bada34bfd73442703.jpg,"인생 멘토와 함께 꿈과 가족을 찾아 떠난
소년의 아주 특별한 여행!

자신이 버려진 아이란 걸 알게 된 소년 레미는
어느 날 거리의 음악가 비탈리스를 만나게 된다.
소년이 가진 아름다운 목소리와 노래의 재능을 알아본 비탈리스는
레미에게 따뜻한 스승이자 인생 멘토가 되어주고,
두 사람은 동물 친구들과 함께 프랑스 전역을 여행하며 공연을 이어간다.

거듭되는 시련들 속에서도 희망을 잃지 않고 꿈을 노래하던 레미는
어느 날 자신의 출생에 숨겨진 비밀을 풀어줄 단서를 알게 되는데...
과연, 레미는 자신의 진짜 가족을 찾을 수 있을까?

올해의 멘티•멘토가 전하는 무공해 감동 대작이 찾아온다!"
