code,title,genre,summering,first_day,production_year,movie_director,star_actor,img,synopsis
20195716,트윈스 (The Twins),공포(호러)(1),"장편 | 일반영화 | 공포(호러), 스릴러 | 97분 39초 | 베트남",해당정보없음,2016년,트란 토안,,https://www.kobis.or.kr/common/mast/movie/2019/08/thumb_x192/thn_0ca0647943264af2b35e52b9feac66c3.jpg,"메이 한은 임신 중에 낙태를 하고 이후에 악몽에 시달린다.
그러다 심령 탐정 사무실을 찾게 되고, 두이 안에게 의뢰를 한다.

한편, 쌍둥이의 한 아이만 실종되는 사건이 벌어진다.

린 단은 두이 안을 좋아하지만
죽은 쌍둥이 형의 애인이어서 서로 계속 엇갈린다.
린 단의 아버지 또한 쌍둥이었고, 엄마를 서로 좋아한 두 형제는 결국
돌이킬 수 없는 짓을 저지르고 마는데..."
20215841,트윈스베베 (I want to become mother),기타,장편 | 일반영화 | 기타 | 86분 34초 | 몽고,해당정보없음,2015년,,,https://www.kobis.or.kr/common/mast/movie/2021/01/thumb_x192/thn_78169f34ade54450948810fecd51e59a.jpg,"솔롱구는 오랫동안 아이를 원했지만 쉽사리 생기지 않아 부부간의 갈등으로까지 이어진 상태이다.
친구 오드코와 점쟁이까지 찾아가 아이를 갖게 해달라고 간청하지만 그들에게 남은 시간은 단 4일뿐.
점집에서 4일 안에 배우자와 밤을 보내야만 아이가 생길 것이라는 이야기를 듣게 된다.
하지만 솔롱구의 남편은 2주 동안 시골에 내려가 있기로 한 상황이었고
아이를 그토록 원하는 솔롱구를 위해 오드코는 신박한 제안을 하게 된다."
20202723,특경대 S.W.A.T (S.W.A.T.),액션(1),"장편 | 일반영화 | 액션, 범죄 | 110분 0초 | 홍콩",해당정보없음,2019년,딩성,,https://www.kobis.or.kr/common/mast/movie/2020/07/thumb_x192/thn_bf7b929c5f424da682e1b892b2abd983.jpg,"북경시 특경 남검돌격대 1팀과 2팀은 늘 티격태격하는 관계. 특경 훈련에서 2팀이 번번이 1팀에게 밀리는 바람에 2팀장 유랑은 대원들을 격려할 궁리로 바쁘다. 마약조직 체포를 위해 실전에 투입된 특경대원들은 클럽에서 뛰어난 실력을 발휘하고, 2팀은 실전 경험을 바탕으로 다음 훈련에서 1팀과 비슷한 성적을 올린다. 한편, 공안 마약팀이 신종 마약 ‘홍’ 제조공장의 위치를 알아내고 특경에 협조 요청이 들어온다. 늘 경쟁하던 1팀과 2팀은 한 조를 이루어 현장에 투입되는데…"
20228855,특공여전사 (Rescue),액션,장편 | 일반영화 | 액션 | 99분 45초 | 15세이상관람가 | 중국,2022-12-26,2019년,,,https://www.kobis.or.kr/kobis/web/comm/images/noimage289.jpg,"T국의 국왕이 총리 관저에서 테러범에게 납치되고 경호를 맡고 있던 바이즈는 눈앞에서 국왕을 놓친다.
바이즈는 구출 작전을 위해 전우들을 소환하고 미녀 특공대는 국왕을 구출하기 위해 밀림으로 향한다.
구출 작전은 생각지도 못한 변수로 인해 난관에 빠지고 국왕 납치의 배후 세력이 점차 드러나는데..."
20202552,특공황비 (Princess the Secret Service Part 1),액션,장편 | 일반영화 | 액션 | 93분 1초 | 중국,해당정보없음,2018년,,장양,https://www.kobis.or.kr/kobis/web/comm/images/noimage289.jpg,"특공 여전사 류여연은 도둑맞은 국보 천기현옥을 되찾기 위해 악당들과 싸우다 정신을 잃고 미지의 세계로 순간이동을 하는데 도착한 곳은 고대의 중국. 여연은 그 곳에서 살아남기 위해 현대 물건과 혁신적인 생각으로 하루 하루를 버티면서 하루 빨리 천기현옥을 찾아 자신이 살던 현대로 돌아갈 방법을 궁리한다. 그러다 여연은 우연히 황권을 노리는 궁내 싸움에 말려들게 되는데... 황제의 병세가 악화되자 직계 태자인 우 태자와 악독한 황후의 아들 주 친왕이 계승자 자리를 놓고 다투게 된다. 황제의 자리를 노리는 자와 그 자리를 지키려는 자, 그리고 천기현옥의 행방을 쫓는 류여연, 이들의 고군분투가 시작된다."
20215106,특공황비2-무적의 적소검 (Princess the Secret Service Part 2),액션,장편 | 예술영화 | 액션 | 97분 6초 | 15세이상관람가 | 중국,2021-05-11,2017년,,장양,https://www.kobis.or.kr/kobis/web/comm/images/noimage289.jpg,"현대의 특공요원 류여연은 고대 세계에 와서 태자를 도와 황위를 되찾아 주었다. 그러나 사악한 신족은 다시금 힘을 되찾아 황권의 상징인 ‘적소검’을 탈취하고, 이를 마화(魔化)시켜 전 세계를 정복하려 한다. 류여연과 친구들은 여러 고난 끝에 ‘적소검’의 마화를 저지하고 사악한 세력의 음모를 다시 한번 쳐부수는데..."
20199267,특권 (THE PRIVILEGED),드라마(1),"장편 | 일반영화 | 드라마, 스릴러 | 78분 36초 | 캐나다",해당정보없음,2013년,리 워커,,https://www.kobis.or.kr/kobis/web/comm/images/noimage289.jpg,"일류 기업의 유망한 젊은 변호사 리차드 헌터는 완벽한 미래를 계획했다. 그러나, 값비싼 고객과의 강력한 실수 때문에 모든 것이 위험에 처하게 되었다. 일자리를 구하기 위한 필사적인 시도로, 리차드와 그의 아내 타라는 선임 파트너인 프레스턴 웨스트우드의 오두막에서 주말을 보낸다. 리차드 부부는 카리스마 넘치는 그들의 사치스러운 생활 방식에 빠르게 매료되지만, 뭔가 불길한 것이 표면밑에 있다는 것이 분명했다. 파괴적인 폭력 행위가 그들이 웨스트우드 가문과 지역 가정 간의 혈투에서 볼모가 되었다는 것을 밝힌 후에, 리차드와 타라는 성공을 위해 무엇을 희생할 것인지 결정해야한다. 그들의 도덕, 결혼, 또는 삶을."
20148147,특명:돈가방을 찾아라 (BAD GIRL),액션(1),"장편 | 일반영화 | 액션, 드라마 | 80분 22초 | 청소년관람불가 | 일본",2014-03-20,2015년,야마가 타카유키,,https://www.kobis.or.kr/common/mast/movie/2019/03/thumb_x192/thn_968026f10cfa4873b9571fd533cd8b53.jpg,"집안 대대로 대도 가문 하마시마의 딸인 성적 매력이 철철 넘치는 유키는 많은 남자들도만나보며 보통 여자로 살고 싶어 아버지에게서 떠나려고 한다. 아버지 밑에서 일을 하는 아카이는 유키와 가장 친한 친구인 미카의 오빠로, 어릴 적 부모에게 버림받은 후 남매 둘이 힘들게 자라왔다.
그러나 미카가 심장병으로 심장을 이식받지 못 하면 죽을 수밖에 없는 상황이 되자 아카이는 동생의 수술비 마련을 위해 하마시마 밑에서 일을 해온 것이었다.
아카이는 유키의 아버지 하마시마에게 수술비를 빌리려고 하지만 하마시마는 냉정하게
거절을 하고 좌절에 빠진 아카이에게 범죄 설계자인 쓰도가 손을 내민다.
하마시마는 쓰도를 통해 중국 마피아와 일본 범죄조직의 마약 거래정보를 알게 되고는
마약 거래 현장을 덮치기로 계획한다. 그러나 인원이 부족하자 하마시마는 건달인
토라 형제를 끌어들여 일을 하려 하는데..."
20215931,특명: 스피드 레스큐 (Speed Rescue),액션(1),"장편 | 일반영화 | 액션, 전쟁 | 82분 2초 | 15세이상관람가 | 홍콩",2021-03-29,2020년,,왕해상,https://www.kobis.or.kr/common/mast/movie/2021/02/thumb_x192/thn_721b4f70fc224248b3a321ccc42f357e.jpg,"2021년 상반기를 장악할 초대형 밀리터리 액션 무비!
거대 범죄 조직 14D를 제패하라!

마약 밀매 조직 14D가 자신들을 방해하는 대부호를 납치하고 대규모 범죄 사건을 계획한다.
이를 저지하기 위해 특수부대 스워드팀이 투입되고 그들에게는 또 다른 전대미문 미션이 주어진다.

최악의 마약 범죄단 VS 지상 최고의 특수부대 스워드팀

3월, 숨 막히는 전투가 펼쳐진다!"
20078360,특별시 사람들 (Where Are You Going?),드라마,장편 | 예술영화 | 드라마 | 110분 0초 | 15세이상관람가 | 한국,해당정보없음,2007년,박철웅,,https://www.kobis.or.kr/upload/up_img/2011/04/thumb_x192/thn_mov_341J24_20110419184032_1.jpg,"하늘이 가장 높은 판자촌에 삼남이네 가족이 살고 있다. 서울 특별시 강남 한복판, 높이 솟은 타워팰리스 바로 옆에 무허가 집들이 즐비한 판자촌이 있다. 판자촌에는 힘든 막노동으로 가족을 생계를 꾸려가는 아버지와 전교 5등하는 모범생 둘째형 이남, 배시시 웃는 모습이 천사 같은 착한 누나 초롱과 거동이 불편한 할머니와 함께 사는 장난꾸러기 삼남이의 집이 있다. 듣는 이의 정신이 몽롱해질 만큼 아름다운 목소리로 노래 부르는 삼남이의 음악적 재능을 알아본 담임 선생님이 삼남이에게 노래 경연대회 출전을 권유하지만 아버지의 완고한 성격과 어려운 집안 형편 때문에 망설여진다. 하지만 삼남이는 남몰래 병을 팔아 산 멜로디언으로 열심히 연습하면서 점점 노래의 매력에 빠져든다. 그곳에는 힘겨울수록 간절해지는 꿈이 있다.어느 날 재개발 소문으로 동네가 술렁이기 시작할 무렵, 집 나갔던 사고 뭉치 첫째 형 ‘일남’이 불쑥 찾아온다. 판자촌 집을 팔면 큰 돈을 벌 수 있다는 ‘일남’과 집을 지키려는 ‘아버지’ 사이에 언성이 높아지고, 모범생이던 둘째 형 ‘이남’마저 밖으로 나돌기만 한다. 의심스러운 외부인들까지 등장한 후 ‘일남’은 상처 투성이가 되어 들어오고 ‘아버지’는 절도 의심을 받고 경찰서에 끌려가게 되는 등 사건이 끊이질 않는다. 동네도 집안도 소란스러워지는 와중에 4남매 집도 다른 사람의 손에 넘어갈 위기에 처하게 된다. 무슨 일이 벌어지는 건지 도통 알 수가 없는 ‘삼남’은 학교 대표로 ‘전국 어린이 노래 경연대회’에 나가서 부를 ‘아베마리아’ 연습에 여념이 없지만, 집을 빼앗기면 대회에도 나갈 수 없다는데…"
20144179,특별한 날 (A Special Day),기타,"장편 | 일반영화 | 기타 | 110분 0초 | 이탈리아, 캐나다",해당정보없음,1977년,에토르 스콜라,소피아 로렌 | 마르첼로 마스트로얀니,https://www.kobis.or.kr/common/mast/movie/2015/12/thumb_x192/thn_9214fdf944f74f6680a6bc4a52dbe68f.jpg,"전 유럽에 파시즘의 기운이 퍼져가던 1938년, 이탈리아에 히틀러가 방문하자 그 분위기는 더욱 고조된다. 그러나 이런 열기와 무관하게 평범한 일상을 보내던 가정주부 안토니에타는 우연히 알게 된 맞은편 집의 기자 가브리엘과 가까워진다. 1978년 이탈리아 골든글로브 최우수작품상, 남우, 여우주연상 수상. 2014년 베니스영화제 최우수복원상 수상."
20192354,특송 (Special Delivery),범죄(1),"장편 | 일반영화 | 범죄, 액션 | 108분 26초 | 15세이상관람가 | 한국",2022-01-12,2020년,박대민,,https://www.kobis.or.kr/common/mast/movie/2021/12/thumb_x192/thn_0fc78405a0cb4c9bae02f073d06ca01d.jpg,"2022년을 여는 가장 짜릿한 범죄 오락 액션의 탄생!

예상치 못한 배송사고로 걷잡을 수 없는 사건에 휘말린
특송 전문 드라이버 ‘은하’.
어쩌다 맡게 된 반송 불가 수하물에 출처를 알 수 없는 300억까지!
경찰과 국정원의 타겟이 되어
도심 한복판 모든 것을 건 추격전을 벌이게 되는데…

NO브레이크! FULL엑셀!
성공률 100% 특송 전문 드라이버가 온다!"
20200799,특수부대 백호 (Peak Rescue),액션,장편 | 일반영화 | 액션 | 74분 41초 | 중국,해당정보없음,2019년,,,https://www.kobis.or.kr/common/mast/movie/2020/10/thumb_x192/thn_ad98aedfbf3e45a5bb6f84362f4a047e.jpg,"아세안 정상회담이 열리는 태국에서
사상 최악의 폭탄 테러가 예고된다.

테러를 막기 위해 최정예 특수부대 백호가 투입되고
치열한 추적과 전투 끝에 조금씩 폭탄의 실체에 접근해 가지만
예고된 폭발은 3시간만을 남기고...

수 만명의 목숨을 구할
지상 최대의 작전이 시작된다"
20216542,특수부대 백호2 (The Sniper),전쟁(1),"장편 | 일반영화 | 전쟁, 액션 | 70분 9초 | 중국",해당정보없음,2020년,,,https://www.kobis.or.kr/common/mast/movie/2021/02/thumb_x192/thn_8388d7610faf4ad4b24a6aa956ae3506.jpg,"마약 조직 소탕 작전을 성공적으로 완수한 특수부대 백호.
명령에 따라 추가적인 수색 작전에 투입된다.
하지만 저격수를 이용한 예상치 못한 적의 매복 공격에
백호부대는 낯선 지역에 고립되게 되고...
보이지 않는 적들 앞에 국가의 운명을 가를 전투가 다가온다."
20224635,특수부대 백호3 (The Underground War),전쟁(1),"장편 | 일반영화 | 전쟁, 액션 | 75분 7초 | 중국",해당정보없음,2021년,,왕도,https://www.kobis.or.kr/common/mast/movie/2022/04/thumb_x192/thn_495a8c48f1514fa1a25c3022c7c57f28.jpg,"가까운 미래, 유례없는 태양 폭발로 인류는 재앙을 맞이하고
살아남은 자들은 지하로 내려가 휴면 캡슐에 몸을 의지해
인공지능의 관리를 받으며 지구의 재생을 기다린다.
한편 재생 계획에서 버림받은 자들은 세력을 모아 대항하고
휴면 중이던 특수부대 백호는 이들과의 전투를 시작한다."
20224911,특수부대 비룡 (Return of Special Forces V Jedi Rescue),액션,장편 | 일반영화 | 액션 | 96분 24초 | 중국,해당정보없음,2021년,후걸,,https://www.kobis.or.kr/common/mast/movie/2022/05/thumb_x192/thn_3574a5e48a5b41c7bbe75006fb0c168f.jpg,"캐나다의 한 호텔이 테러리스트들에게 점령당한다.
임무를 위해 그곳에 잠입한 비룡부대의 룽웨이는
생각지 못했던 거대한 음모가 있음을 알게 되고,
특수부대 비룡과 세계를 구할 최후의 작전을 준비한다."
20192581,특수부대 스콜피온 (Scorpion Task),액션,장편 | 일반영화 | 액션 | 73분 14초 | 15세이상관람가 | 중국,2019-07-09,2018년,맹우,,https://www.kobis.or.kr/common/mast/movie/2019/06/thumb_x192/thn_04adf1404e0647b39fb0e086df10547b.jpg,"중국 최정예 부대인 ‘스콜피온’의 부대원들이 작전 도중 몰살당하는 사건이 발생한다.
유일하게 살아남은 ‘루위안항’은 새로운 부대원을 모집하고,
각 부대에서 차출된 엘리트 군인들이 한자리에 모이게 된다.
10개의 팀으로 나눠진 이들은 주어진 시간 15일 동안
무슨 일이 있어도 반드시 살아남아야 하는데…

최고의 특수부대원이 되기 위한 관문!
타협은 없다! 끝까지 살아남아라!"
20211526,특수부대 코만도 (Pharaoh's War),액션,장편 | 예술영화 | 액션 | 116분 26초 | 15세이상관람가 | 기타,2022-01-25,2019년,,마이크 타이슨,https://www.kobis.or.kr/kobis/web/comm/images/noimage289.jpg,이슬람 갱단에 납치된 아들을 구하려는 파라오와 여섯 친구들의 활약과 사투를 그린 범죄 액션 영화
20210572,특수부대 풍운 (Siping Situation),액션,장편 | 일반영화 | 액션 | 78분 59초 | 중국,해당정보없음,2019년,,얀 지에,https://www.kobis.or.kr/common/mast/movie/2021/09/thumb_x192/thn_17ce3ee398ab4284a34ddc5941b22d47.jpg,"불법 마약 조직 소탕 작전이 실패하고 신종 마약이 사라진다.
작전을 알았던 사람은 오직 4명.
현장에서 사망한 이청후가 아니라면 내부 기밀을 유출할 수 있는 사람은 오직 마약 단속반 팀장인 저우쉰뿐.
한편, 이청후의 조력자이자 또 다른 스파이인 장하오는 이청후의 유언을 지키기 위해 신종 마약을 훔친 일당을 뒤쫓는데...

내부 스파이를 잡고 거대 마약조직을 소탕하라!"
20226754,특수부대 UDA (Warrior Kings),액션,장편 | 일반영화 | 액션 | 78분 21초 | 중국,해당정보없음,2021년,,,https://www.kobis.or.kr/kobis/web/comm/images/noimage289.jpg,"라스트 10분, 지구의 운명을 위해 싸워라!

지구를 침략해 약탈과 살육을 일삼는 외계인에 맞서 지구를 지키는 연합 방위군 UDA.
'방주 프로젝트' 대상인 박사를 구출하기 위한 UDA 부대의 마지막 작전이 시작된다"
20180663,특수부대: 스카이 헌터 (Sky Hunter),액션(1),"장편 | 일반영화 | 액션, 전쟁 | 114분 59초 | 12세이상관람가 | 홍콩",해당정보없음,2016년,리 첸,리 첸 | 판빙빙,https://www.kobis.or.kr/common/mast/movie/2018/08/thumb_x192/thn_c61bb6ceb3444a60af5723364e78eb0e.jpg,"하늘을 가르는 스카이 헌터의 공중 전투가 시작된다!
공군 사관 학교를 졸업한 우디(리천)와 야리(판빙빙)는 공군 특수 부대 '스카이 헌터'에 지원하고, 하오천(리자항)은 중국 국경과 맞대고 있는 국가 '마부'의 공군 기지에서 비행을 가르친다.
어느 날, 테러 조직은 마부의 공군 기지를 장악하고, 기지에서 일하던 마부인과 중국인 직원들을납치한다. 하오천은 인질들을 구하려고 하지만, 사람들을 구하려면 순순히 테러범들의 지시를 따르라는 ‘마부’의 일급 조종사 라흐만의 조언을 받아들인다. 테러 조직은 자신들의 수장을 석방하라고 요구하자, 마부 정부는 중국에 ‘스카이 헌터’의 출격 지원을 요청한다. 선두 비행사로 나선 우디는 테러범들을 진압하고 인질들을 구출하는 임무를 맡고, 전투기를 탈취한 테러조직과의 공중 추격이 시작되는데.."
20207495,특수요원,액션,장편 | 독립영화 | 액션 | 94분 30초 | 15세이상관람가 | 한국,해당정보없음,2020년,신재명,,https://www.kobis.or.kr/common/mast/movie/2020/11/thumb_x192/thn_5ecc91fb810b4d83be9bacc7edbbda84.jpg,"북한의 숨겨진 VIP를 제거하라!

대한민국 국가정보원 '원철'은
한 가지 임무를 제안 받는다.

북한에서 대량 살상 무기를 개발하는
작전에 가담한 VIP를 제거하라는 것.

'원철'은 위험에 빠진 딸 '아름'을 생각하며
어쩔 수 없이 임무를 받아들이는데...

남북 특수요원들의 비밀작전이 시작된다!"
20224891,특수요원 빼꼼 (Agent Backkom : Kings Bear),애니메이션,장편 | 예술영화 | 애니메이션 | 92분 54초 | 전체관람가 | 중국,2022-06-01,2021년,장양,박시윤(디키) | 장병관(빅투스),https://www.kobis.or.kr/common/mast/movie/2022/05/thumb_x192/thn_12fdd4338cbe43f39f9ac7a042477f30.jpg,"정보국이 개발한 슈퍼칩으로 엄청난 능력을 얻게 된 특수요원 지망생 ‘빼꼼’은
정식 요원이 되기 위해 열심히 훈련에 임하지만 아무런 임무가 주어지지 않는다.
실망에 빠진 '빼꼼'은 몰래 정보국을 빠져나와 직접 임무를 찾아 나서고
그러던 중 정체를 알 수 없는 악당의 습격으로 슈퍼칩을 빼앗기고 마는데...

과연 '빼꼼'은 의문의 악당에게 빼앗긴 슈퍼칩을 되찾아
진정한 특수요원으로 거듭날 수 있을 것인가!"
20191544,특수요원 작전명 P-69,액션,장편 | 일반영화 | 액션 | 한국,해당정보없음,2019년,,공정환,https://www.kobis.or.kr/kobis/web/comm/images/noimage289.jpg,DMZ에서 벌어지는 남북한 특수요원들의 격투 이야기를 담은 영화
20209606,특수요원 K (Kadaram Kondan),액션,장편 | 일반영화 | 액션 | 112분 40초 | 기타,해당정보없음,2019년,,치얀 비크람(KK),https://www.kobis.or.kr/common/mast/movie/2020/05/thumb_x192/thn_4fff87e79b8947ad934cf3f407192d4b.jpg,"거대 조직의 음모로 살인 누명을 쓴 채
도망자 신세가 된 킬러이자 특수요원 ‘KK’.
그리고 혼수상태로 실려온 ‘KK’의 목숨을 구해준 의사 ‘바수’.
끝없이 ‘KK’의 목숨을 노리는 거대 조직은,
‘바수’의 아내를 납치한 후 병원에 있는 ‘KK’를 넘기라 ‘바수’를 협박한다.
결국 아내를 구하기 위해 ‘KK’를 빼내던 ‘바수’,
하지만 ‘KK’는 극적으로 혼수상태에서 깨어나 이 모든 사실을 알게 된다.
서로 다른 목적으로 한 팀이 된 두 사람.
지옥에서 돌아 온 자들의
쫓고 쫓기는 추격이 시작된다!"
20228972,특수요원S (Action),액션,장편 | 일반영화 | 액션 | 144분 43초 | 인도,해당정보없음,2019년,,,https://www.kobis.or.kr/common/mast/movie/2022/11/thumb_x192/thn_52c5c92b0ad04085960ae7d7a88d7f7e.jpeg,"인도에서 일어난 대규모 폭탄 테러에 수많은 사람들이 목숨을 잃게 되고
사랑하는 이들을 잃은 특수요원S는 국제 테러리스트 조직을 처리하기 위해 불가능한 작전을 시작한다."
20217928,특수팀 (The Void Evidence),드라마(1),"장편 | 일반영화 | 드라마, 액션 | 83분 9초 | 중국",해당정보없음,2019년,,,https://www.kobis.or.kr/kobis/web/comm/images/noimage289.jpg,산악 도시에서 연쇄 살인 사건이 발생하고 모두가 경계 태세를 갖추고 있다. 수사팀은 살인 사건이 생중계된 익명의 메일을 받고 즉시 조사에 착수한다. 하지만 범인은 살인마다 단서를 남기고 수사는 갈수록 복잡해지는데...
20211733,특종 기자,기타,장편 | 일반영화 | 기타 | 96분 47초 | 한국,해당정보없음,2020년,장유근,,https://www.kobis.or.kr/common/mast/movie/2021/11/thumb_x192/thn_457834371215468899cca90d3cebfaad.png,기자가 되기를 원하는 현빈. 최 회장은 그에게 김도식이라는 인물만 찾아준다면 그의 꿈을 이루어 주겠다고 한다. 최회장의 지령을 받고 몽골로 떠난 현빈은 몽골에서 김도식의 행방을 수소문한다. 김도식이라는 인물에게 점점 다가갈수록 그에게는 기이한 일이 벌어진다. 점차 악화되어가는 상황 속에서 결국 현빈은 무언가 건드려서는 안 될 것을 건드려 버리고… 더 이상 감당할 수 없는 현실과 마주하게 된다.
20199029,특종병기 전랑 (Tezhongbingguilai 1),액션,장편 | 예술영화 | 액션 | 83분 29초 | 15세이상관람가 | 중국,해당정보없음,2018년,후걸,,https://www.kobis.or.kr/common/mast/movie/2019/10/thumb_x192/thn_690f6ab7fb404cc484d6c4914acb1010.jpg,"5년 전 블러드 울프 특수부대는 작전에 실패해 5명의 특전 대원들을 잃는다.
지휘관인 울프킹 룡위는 대산과 마예 두 전우를 구했지만, 나머지 다섯 명의 대원들을 구하지 못했단 죄책감에 은둔 생활을 자처하고 만다. 이로부터 5년 후, 룡위는 당시 중국 마약 수사관이었던 ‘상곤’의 배신이 작전 실패의 원인이었음을 알게 된다. 룡위는 비리와 부정부패로 마약 수사국장이 되어 부와 명예를 쌓은 상곤에게 피의 복수를 결심하는데…

형제들의 복수를 갚기 위해 목숨을 건 그들의 전쟁이 시작된다!"
20193530,특종병기 전랑:마약전쟁 (Tezhongbingguilai 2),액션(2),"장편 | 일반영화 | 액션, 범죄, 드라마 | 64분 39초 | 15세이상관람가 | 중국",해당정보없음,2018년,후걸,,https://www.kobis.or.kr/kobis/web/comm/images/noimage289.jpg,마약단 소탕에 나선 전직 특수부대원들의 활약을 그린 액션 영화
20174647,튼튼이의 모험 (Loser's Adventure),코미디,"장편 | 예술,독립 영화 | 코미디 | 106분 52초 | 15세이상관람가 | 한국",2018-06-21,2017년,고봉수,,https://www.kobis.or.kr/common/mast/movie/2018/06/thumb_x192/thn_79272259315946c7a1d25f6d2bf9b9bc.jpg,"전국체전 예선 2주 전, 존폐위기의 고교 레슬링 부에서 벌어지는
땀내나는 녀석들의 고군분투 삽질 코미디

빽도 재능도 없지만 레슬링에 대한 사랑만큼은 국가대표 급인 튼튼한 18세 소년 ‘충길’. 대풍고 레슬링부에 남은 유일한 선수인 충길은 체육관을 지키며,
시내버스 운전기사로 전업한 코치 ‘상규’와 엄마를 고향 필리핀에 보내주기 위해 막노동을 시작한 친구 ‘진권’을 찾아 운동을 계속하자고 조른다.

충길의 진심이 통했을까! 전국체전의 예선 출전권을 따낸 대풍고 레슬링부는 소박한 목표, 단 1승을 위해 최후의 지옥훈련에 돌입한다.
게다가 진권의 여동생을 보고 한눈에 반한 불량써클 블랙타이거의 멤버 ‘혁준’까지 레슬링부에 가세, 파이터의 천부적인 재능을 발휘하며 레슬링부의 새로운 희망으로 떠오른다.
과연 18세 레슬러 튼튼이들은 예선 1승, 더 나아가 전국체전 진출이라는 기적을 이뤄낼 수 있을까!"
2023C822,티라노 VS 스네이크 (Metamorphosis),액션,온라인전용 | 일반영화 | 액션 | 70분 1초 | 중국,해당정보없음,2022년,,,https://www.kobis.or.kr/common/mast/movie/2023/02/thumb_x192/thn_b2e4c0ef03884c94966cf8f1c7715a4d.jpg,"육지 최강자 티라노사우루스 VS 유전자 변경 스네이크

진 연구소는 유전자 조작으로 티라노사우루스를 부활시킨다. 하지만 유전자 변형으로 진화를 거듭한 메가 스네이크가 사람들을 기습하기 시작하자 포식자들의 마지막 대결이 시작된다!"
